{
  "loads and parses files": {
    "objType": "Action",
    "name": "loads and parses files",
    "desc": "",
    "actType": "atRunExtApp",
    "exePath": "",
    "formData": {
      "caType": "MAAP",
      "exePath": "C:/MAAP.exe",
      "fileRefs": ["Test.PAR", "Test.INC"],
      "initiators": [
        {
          "comments": [[], ["Doc comment"]],
          "target": {
            "type": "identifier",
            "value": "INIT1"
          },
          "type": "assignment",
          "value": {
            "type": "boolean",
            "value": true
          }
        },
        {
          "comments": [[], []],
          "target": {
            "type": "identifier",
            "value": "INIT2"
          },
          "type": "assignment",
          "value": {
            "type": "number",
            "value": 0
          }
        }
      ],
      "inputBlocks": [
        {
          "type": "conditional_block",
          "blockType": "WHEN",
          "comments": [[], []],
          "test": {
            "type": "expression",
            "left": {
              "type": "identifier",
              "value": "TIM"
            },
            "op": ">=",
            "right": {
              "type": "number",
              "units": "S",
              "value": 0
            }
          },
          "value": [
            {
              "comments": [[], []],
              "target": {
                "type": "identifier",
                "value": "INIT1"
              },
              "type": "assignment",
              "value": {
                "type": "boolean",
                "value": false
              }
            }
          ]
        }
      ],
      "inputPath": "C:/Test.INP",
      "needsUpgrade": false,
      "parameterPath": "C:/Test.PAR",
      "parameters": [
        {
          "comments": [[], []],
          "target": {
            "type": "identifier",
            "value": "PARAM1"
          },
          "type": "assignment",
          "value": {
            "type": "number",
            "value": 5
          }
        },
        {
          "comments": [[], []],
          "target": {
            "arguments": [
              {
                "type": "number",
                "value": 1
              }
            ],
            "type": "call_expression",
            "value": {
              "type": "identifier",
              "value": "PARAM2"
            }
          },
          "type": "assignment",
          "value": {
            "type": "number",
            "value": 6,
            "units": "FT"
          }
        }
      ],
      "possibleInitiators": [
        {
          "index": 100,
          "desc": "PARAM1",
          "value": "T",
          "type": "parameter"
        },
        {
          "index": 101,
          "desc": "PARAM2",
          "value": "T",
          "type": "parameter"
        }
      ],
      "sourceElements": [
        {
          "comments": [[], []],
          "type": "sensitivity",
          "value": "ON"
        },
        {
          "comments": [[], []],
          "type": "title",
          "value": "TESTINP"
        },
        {
          "comments": [[], []],
          "fileType": "PARAMETER FILE",
          "type": "file",
          "value": "Test.PAR"
        },
        {
          "comments": [[], []],
          "fileType": "INCLUDE",
          "type": "file",
          "value": "Test.INC"
        },
        {
          "comments": [[], []],
          "type": "block",
          "blockType": "PARAMETER CHANGE",
          "value": [
            {
              "comments": [[], []],
              "target": {
                "type": "identifier",
                "value": "PARAM1"
              },
              "type": "assignment",
              "value": {
                "type": "number",
                "value": 5
              }
            },
            {
              "comments": [[], []],
              "target": {
                "arguments": [
                  {
                    "type": "number",
                    "value": 1
                  }
                ],
                "type": "call_expression",
                "value": {
                  "type": "identifier",
                  "value": "PARAM2"
                }
              },
              "type": "assignment",
              "value": {
                "type": "number",
                "value": 6,
                "units": "FT"
              }
            }
          ]
        },
        {
          "comments": [[], []],
          "type": "alias",
          "value": [
            {
              "comments": [[], []],
              "target": {
                "type": "identifier",
                "value": "PARAM1"
              },
              "type": "as_expression",
              "value": {
                "type": "parameter_name",
                "value": "ALIAS PARAM"
              }
            }
          ]
        },
        {
          "comments": [[], []],
          "type": "block",
          "blockType": "INITIATORS",
          "value": [
            {
              "comments": [[], ["Doc comment"]],
              "target": {
                "type": "identifier",
                "value": "INIT1"
              },
              "type": "assignment",
              "value": {
                "type": "boolean",
                "value": true
              }
            },
            {
              "comments": [[], []],
              "target": {
                "type": "identifier",
                "value": "INIT2"
              },
              "type": "assignment",
              "value": {
                "type": "number",
                "value": 0
              }
            }
          ]
        },
        {
          "comments": [[], []],
          "blockType": "WHEN",
          "test": {
            "type": "expression",
            "left": {
              "type": "identifier",
              "value": "TIM"
            },
            "op": ">=",
            "right": {
              "type": "number",
              "units": "S",
              "value": 0
            }
          },
          "type": "conditional_block",
          "value": [
            {
              "comments": [[], []],
              "target": {
                "type": "identifier",
                "value": "INIT1"
              },
              "type": "assignment",
              "value": {
                "type": "boolean",
                "value": false
              }
            }
          ]
        },
        {
          "comments": [[], []],
          "target": {
            "type": "parameter_name",
            "value": "PRINT INTERVAL"
          },
          "type": "is_expression",
          "value": {
            "type": "number",
            "value": 50
          }
        },
        {
          "comments": [[], []],
          "target": {
            "type": "parameter_name",
            "value": "START TIME"
          },
          "type": "is_expression",
          "value": {
            "type": "number",
            "units": "HR",
            "value": 0
          }
        },
        {
          "comments": [[], []],
          "target": {
            "type": "parameter_name",
            "value": "END TIME"
          },
          "type": "is_expression",
          "value": {
            "type": "number",
            "units": "HR",
            "value": 10
          }
        },
        {
          "comments": [[], []],
          "type": "plotfil",
          "n": 100,
          "value": [
            {
              "comments": [],
              "row": [
                {
                  "type": "parameter_name",
                  "value": "TIME IN SECONDS"
                }
              ]
            },
            {
              "comments": [],
              "row": [
                {
                  "type": "parameter_name",
                  "value": "ALIAS PARAM"
                }
              ]
            }
          ]
        }
      ]
    },
    "mainItem": true,
    "makeInputFileCode": "string exeLoc = \"C:/MAAP.exe\";\n        string paramLoc = \"C:/Test.PAR\";\n        string inpLoc = \"C:/Test.INP\";\n        string newInp = @\"SENSITIVITY ON\nTITLE\nTESTINP\nEND\nPARAMETER FILE Test.PAR\nINCLUDE Test.INC\nPARAMETER CHANGE\nPARAM1 = 5\nPARAM2(1) = 6 FT\nEND\nALIAS\nPARAM1 AS ALIAS PARAM\nEND\nINITIATORS\nINIT1 = T\nINIT2 = 0\nEND\nWHEN TIM >= 0 S\nINIT1 = F\nEND\nPRINT INTERVAL IS 50\nSTART TIME IS 0 HR\nEND TIME IS 10 HR\nPLOTFIL 100\nTIME IN SECONDS\nALIAS PARAM\nEND\";\n        string fileRefs = \"Test.PAR,Test.INC\"; //example \"PVGS_502.par, test.txt\";\n        string[] fileRefsList = fileRefs.Split(',');\n        \n        if (!Path.IsPathRooted(exeLoc))\n        {\n          exeLoc = Path.Join(Directory.GetCurrentDirectory(), exeLoc);\n        }\n        if (!Path.IsPathRooted(paramLoc))\n        {\n          paramLoc = Path.Join(Directory.GetCurrentDirectory(), paramLoc);\n        }\n        if (!Path.IsPathRooted(inpLoc))\n        {\n          inpLoc = Path.Join(Directory.GetCurrentDirectory(), inpLoc);\n        }\n        \n        string tempLoc = Path.Join(Environment.GetFolderPath(Environment.SpecialFolder.ApplicationData), \"EMRALD_MAAP\");\n        try\n        {\n          if (Directory.Exists(tempLoc))\n          {\n            Directory.Delete(tempLoc, true);\n          }\n          Directory.CreateDirectory(tempLoc);\n        }\n        catch { }\n        if (File.Exists(paramLoc) && !File.Exists(Path.Join(tempLoc, Path.GetFileName(paramLoc))))\n        {\n          File.Copy(paramLoc, Path.Join(tempLoc, Path.GetFileName(paramLoc)));\n        }\n        \n        string paramFileName = Path.GetFileName(paramLoc);\n        string inpFileName = Path.GetFileName(inpLoc);\n        string inpLocPath = Path.GetDirectoryName(inpLoc);\n        foreach (string fileRef in fileRefsList)\n        {\n          string fileRefPath = Path.Join(inpLocPath, fileRef);\n          if (File.Exists(fileRefPath) && !File.Exists(Path.Join(tempLoc, fileRef)))\n          {\n            if (fileRef != paramFileName)\n            File.Copy(fileRefPath, Path.Join(tempLoc, fileRef));\n          }\n          else\n          {\n            Console.WriteLine(\"Missing MAAP referenced file - \" + Path.Join(inpLocPath, fileRef));\n          }\n        }\n        string exeName = Path.GetFileName(exeLoc);\n        if (File.Exists(exeLoc) && !File.Exists(Path.Join(tempLoc, exeName)))\n        {\n          File.Copy(exeLoc, Path.Join(tempLoc, exeName));\n        }\n        string dllPath = Path.Join(Path.GetDirectoryName(exeLoc), exeName[..^7] + \".dll\");\n        if (File.Exists(dllPath) && !File.Exists(Path.Join(tempLoc, Path.GetFileName(dllPath))))\n        {\n          File.Copy(dllPath, Path.Join(tempLoc, Path.GetFileName(dllPath)));\n        }\n        \n        string newInpLoc = Path.Join(tempLoc, inpFileName);\n        System.IO.File.WriteAllText(newInpLoc, newInp);\n        return $\"{Path.Join(tempLoc, exeName)} {inpFileName} {paramFileName}\";",
    "processOutputFileCode": "string inpLoc = @\"C:/Test.INP\";\n  if (!Path.IsPathRooted(inpLoc))\n        inpLoc = RootPath + inpLoc;\n    string docVarPath = @\"./MAAP/temp.log\";\n  if (!Path.IsPathRooted(docVarPath))\n        docVarPath = RootPath + docVarPath;\n  string resLoc = Path.Join(Environment.GetFolderPath(Environment.SpecialFolder.ApplicationData), \"EMRALD_MAAP\", Path.GetFileNameWithoutExtension(inpLoc) + \".log\");\n  Directory.CreateDirectory(Path.GetDirectoryName(docVarPath));\n  File.Copy(resLoc, docVarPath, true);",
    "raType": "custom",
    "returnProcess": "rtNone",
    "codeVariables": []
  },
  "uses variables": {
    "objType": "Action",
    "name": "uses variables",
    "desc": "",
    "actType": "atRunExtApp",
    "exePath": "",
    "formData": {
      "caType": "MAAP",
      "docComments": {},
      "exePath": "C:/MAAP.exe",
      "fileRefs": ["Test.PAR", "Test.INC"],
      "initiators": [
        {
          "comment": " Doc comment",
          "name": "INIT1",
          "value": true
        },
        {
          "comment": "",
          "name": "INIT2",
          "value": 0
        }
      ],
      "inputBlocks": [
        {
          "type": "conditional_block",
          "blockType": "WHEN",
          "test": {
            "type": "expression",
            "value": {
              "left": {
                "type": "identifier",
                "value": "TIM"
              },
              "op": ">=",
              "right": {
                "type": "identifier",
                "units": "S",
                "value": "Test Variable",
                "useVariable": true
              }
            }
          },
          "value": [
            {
              "target": {
                "type": "identifier",
                "value": "INIT1"
              },
              "type": "assignment",
              "value": {
                "type": "identifier",
                "value": "Test Variable",
                "useVariable": true
              }
            }
          ]
        }
      ],
      "inputFile": {},
      "inputPath": "C:/Test.INP",
      "parameterFile": {},
      "parameterPath": "C:/Test.PAR",
      "parameters": [
        {
          "name": "PARAM1",
          "type": "parameter",
          "useVariable": true,
          "unit": "",
          "value": "5",
          "variable": "Test Variable"
        },
        {
          "name": "PARAM2(1)",
          "type": "parameter",
          "useVariable": false,
          "unit": "FT",
          "value": "6"
        }
      ],
      "possibleInitiators": [
        {
          "comment": "",
          "index": 100,
          "desc": "PARAM1",
          "value": "T",
          "type": "parameter"
        },
        {
          "comment": "",
          "index": 101,
          "desc": "PARAM2",
          "value": "T",
          "type": "parameter"
        }
      ],
      "sourceElements": [
        {
          "type": "sensitivity",
          "value": "ON"
        },
        {
          "type": "title",
          "value": "TESTINP"
        },
        {
          "fileType": "PARAMETER FILE",
          "type": "file",
          "value": "Test.PAR"
        },
        {
          "fileType": "INCLUDE",
          "type": "file",
          "value": "Test.INC"
        },
        {
          "type": "block",
          "blockType": "PARAMETER CHANGE",
          "value": [
            {
              "target": {
                "type": "identifier",
                "value": "PARAM1"
              },
              "type": "assignment",
              "value": {
                "type": "number",
                "value": 5
              }
            },
            {
              "target": {
                "arguments": [
                  {
                    "type": "number",
                    "value": 1
                  }
                ],
                "type": "call_expression",
                "value": {
                  "type": "identifier",
                  "value": "PARAM2"
                }
              },
              "type": "assignment",
              "value": {
                "type": "number",
                "value": 6,
                "units": "FT"
              }
            }
          ]
        },
        {
          "type": "alias",
          "value": [
            {
              "target": {
                "type": "identifier",
                "value": "PARAM1"
              },
              "type": "as_expression",
              "value": {
                "type": "parameter_name",
                "value": "ALIAS PARAM"
              }
            }
          ]
        },
        {
          "type": "block",
          "blockType": "INITIATORS",
          "value": [
            {
              "target": {
                "type": "identifier",
                "value": "INIT1"
              },
              "type": "assignment",
              "value": {
                "type": "boolean",
                "value": true
              }
            },
            {
              "type": "comment",
              "value": " Doc comment"
            },
            {
              "target": {
                "type": "identifier",
                "value": "INIT2"
              },
              "type": "assignment",
              "value": {
                "type": "number",
                "value": 0
              }
            }
          ]
        },
        {
          "blockType": "WHEN",
          "test": {
            "type": "expression",
            "value": {
              "left": {
                "type": "identifier",
                "value": "TIM"
              },
              "op": ">=",
              "right": {
                "type": "identifier",
                "units": "S",
                "value": "Test Variable",
                "useVariable": true
              }
            }
          },
          "type": "conditional_block",
          "value": [
            {
              "target": {
                "type": "identifier",
                "value": "INIT1"
              },
              "type": "assignment",
              "value": {
                "type": "identifier",
                "value": "Test Variable",
                "useVariable": true
              }
            }
          ]
        },
        {
          "target": {
            "type": "parameter_name",
            "value": "PRINT INTERVAL"
          },
          "type": "is_expression",
          "value": {
            "type": "number",
            "value": 50
          }
        },
        {
          "target": {
            "type": "parameter_name",
            "value": "START TIME"
          },
          "type": "is_expression",
          "value": {
            "type": "number",
            "units": "HR",
            "value": 0
          }
        },
        {
          "target": {
            "type": "parameter_name",
            "value": "END TIME"
          },
          "type": "is_expression",
          "value": {
            "type": "number",
            "units": "HR",
            "value": 10
          }
        },
        {
          "type": "plotfil",
          "n": 100,
          "value": [
            [
              {
                "type": "parameter_name",
                "value": "TIME IN SECONDS"
              }
            ],
            [
              {
                "type": "parameter_name",
                "value": "ALIAS PARAM"
              }
            ]
          ]
        }
      ]
    },
    "mainItem": true,
    "makeInputFileCode": "string exeLoc = \"C:/MAAP.exe\";\n        string paramLoc = \"C:/Test.PAR\";\n        string inpLoc = \"C:/Test.INP\";\n        string newInp = @\"SENSITIVITY ON\nTITLE\nTESTINP\nEND\nPARAMETER FILE Test.PAR\nINCLUDE Test.INC\nPARAMETER CHANGE\nPARAM1 = \" + Test Variable + @\"\nPARAM2(1) = 6 FT\nEND\nALIAS\nPARAM1 AS ALIAS PARAM\nEND\nINITIATORS\nINIT1 = T\nINIT2 = 0\nEND\nWHEN TIM >= \" + Test Variable + @\"\nINIT1 = \" + Test Variable + @\"\nEND\nPRINT INTERVAL IS 50\nSTART TIME IS 0 HR\nEND TIME IS 10 HR\nPLOTFIL 100\nTIME IN SECONDS\nALIAS PARAM\nEND\n\";\n        string fileRefs = \"Test.PAR,Test.INC\"; //example \"PVGS_502.par, test.txt\";\n        string[] fileRefsList = fileRefs.Split(',');\n        \n        if (!Path.IsPathRooted(exeLoc))\n        {\n          exeLoc = Path.Join(Directory.GetCurrentDirectory(), exeLoc);\n        }\n        if (!Path.IsPathRooted(paramLoc))\n        {\n          paramLoc = Path.Join(Directory.GetCurrentDirectory(), paramLoc);\n        }\n        if (!Path.IsPathRooted(inpLoc))\n        {\n          inpLoc = Path.Join(Directory.GetCurrentDirectory(), inpLoc);\n        }\n        \n        string tempLoc = Path.Join(Environment.GetFolderPath(Environment.SpecialFolder.ApplicationData), \"EMRALD_MAAP\");\n        try\n        {\n          if (Directory.Exists(tempLoc))\n          {\n            Directory.Delete(tempLoc, true);\n          }\n          Directory.CreateDirectory(tempLoc);\n        }\n        catch { }\n        if (File.Exists(paramLoc) && !File.Exists(Path.Join(tempLoc, Path.GetFileName(paramLoc))))\n        {\n          File.Copy(paramLoc, Path.Join(tempLoc, Path.GetFileName(paramLoc)));\n        }\n        \n        string paramFileName = Path.GetFileName(paramLoc);\n        string inpFileName = Path.GetFileName(inpLoc);\n        string inpLocPath = Path.GetDirectoryName(inpLoc);\n        foreach (string fileRef in fileRefsList)\n        {\n          string fileRefPath = Path.Join(inpLocPath, fileRef);\n          if (File.Exists(fileRefPath) && !File.Exists(Path.Join(tempLoc, fileRef)))\n          {\n            if (fileRef != paramFileName)\n            File.Copy(fileRefPath, Path.Join(tempLoc, fileRef));\n          }\n          else\n          {\n            Console.WriteLine(\"Missing MAAP referenced file - \" + Path.Join(inpLocPath, fileRef));\n          }\n        }\n        string exeName = Path.GetFileName(exeLoc);\n        if (File.Exists(exeLoc) && !File.Exists(Path.Join(tempLoc, exeName)))\n        {\n          File.Copy(exeLoc, Path.Join(tempLoc, exeName));\n        }\n        string dllPath = Path.Join(Path.GetDirectoryName(exeLoc), exeName[..^7] + \".dll\");\n        if (File.Exists(dllPath) && !File.Exists(Path.Join(tempLoc, Path.GetFileName(dllPath))))\n        {\n          File.Copy(dllPath, Path.Join(tempLoc, Path.GetFileName(dllPath)));\n        }\n        \n        string newInpLoc = Path.Join(tempLoc, inpFileName);\n        System.IO.File.WriteAllText(newInpLoc, newInp);\n        return $\"{Path.Join(tempLoc, exeName)} {inpFileName} {paramFileName}\";",
    "processOutputFileCode": "string inpLoc = @\"C:/Test.INP\";\n  if (!Path.IsPathRooted(inpLoc))\n        inpLoc = RootPath + inpLoc;\n    string docVarPath = @\"./MAAP/temp.log\";\n  if (!Path.IsPathRooted(docVarPath))\n        docVarPath = RootPath + docVarPath;\n  string resLoc = Path.Join(Environment.GetFolderPath(Environment.SpecialFolder.ApplicationData), \"EMRALD_MAAP\", Path.GetFileNameWithoutExtension(inpLoc) + \".log\");\n  Directory.CreateDirectory(Path.GetDirectoryName(docVarPath));\n  File.Copy(resLoc, docVarPath, true);",
    "raType": "custom",
    "returnProcess": "rtNone",
    "codeVariables": ["Test Variable"]
  },
  "modifies initiators": {
    "objType": "Action",
    "name": "modifies initiators",
    "desc": "",
    "actType": "atRunExtApp",
    "exePath": "",
    "formData": {
      "caType": "MAAP",
      "exePath": "C:/MAAP.exe",
      "fileRefs": ["Test.PAR", "Test.INC"],
      "initiators": [
        {
          "comments": [[], ["Doc comment"]],
          "target": {
            "type": "identifier",
            "value": "INIT1"
          },
          "type": "assignment",
          "value": {
            "type": "boolean",
            "value": true
          }
        },
        {
          "comments": [[], []],
          "target": {
            "type": "identifier",
            "value": "PARAM1"
          },
          "type": "assignment",
          "value": {
            "type": "identifier",
            "value": "T"
          }
        }
      ],
      "inputBlocks": [
        {
          "type": "conditional_block",
          "blockType": "WHEN",
          "comments": [[], []],
          "test": {
            "type": "expression",
            "left": {
              "type": "identifier",
              "value": "TIM"
            },
            "op": ">=",
            "right": {
              "type": "number",
              "units": "S",
              "value": 0
            }
          },
          "value": [
            {
              "comments": [[], []],
              "target": {
                "type": "identifier",
                "value": "INIT1"
              },
              "type": "assignment",
              "value": {
                "type": "boolean",
                "value": false
              }
            }
          ]
        }
      ],
      "inputPath": "C:/Test.INP",
      "parameterPath": "C:/Test.PAR",
      "needsUpgrade": false,
      "parameters": [
        {
          "comments": [[], []],
          "target": {
            "type": "identifier",
            "value": "PARAM1"
          },
          "type": "assignment",
          "value": {
            "type": "number",
            "value": 5
          }
        },
        {
          "comments": [[], []],
          "target": {
            "arguments": [
              {
                "type": "number",
                "value": 1
              }
            ],
            "type": "call_expression",
            "value": {
              "type": "identifier",
              "value": "PARAM2"
            }
          },
          "type": "assignment",
          "value": {
            "type": "number",
            "units": "FT",
            "value": 6
          }
        }
      ],
      "possibleInitiators": [
        {
          "index": 100,
          "desc": "PARAM1",
          "value": "T",
          "type": "parameter"
        },
        {
          "index": 101,
          "desc": "PARAM2",
          "value": "T",
          "type": "parameter"
        }
      ],
      "sourceElements": [
        {
          "comments": [[], []],
          "type": "sensitivity",
          "value": "ON"
        },
        {
          "comments": [[], []],
          "type": "title",
          "value": "TESTINP"
        },
        {
          "comments": [[], []],
          "fileType": "PARAMETER FILE",
          "type": "file",
          "value": "Test.PAR"
        },
        {
          "comments": [[], []],
          "fileType": "INCLUDE",
          "type": "file",
          "value": "Test.INC"
        },
        {
          "comments": [[], []],
          "type": "block",
          "blockType": "PARAMETER CHANGE",
          "value": [
            {
              "comments": [[], []],
              "target": {
                "type": "identifier",
                "value": "PARAM1"
              },
              "type": "assignment",
              "value": {
                "type": "number",
                "value": 5
              }
            },
            {
              "comments": [[], []],
              "target": {
                "arguments": [
                  {
                    "type": "number",
                    "value": 1
                  }
                ],
                "type": "call_expression",
                "value": {
                  "type": "identifier",
                  "value": "PARAM2"
                }
              },
              "type": "assignment",
              "value": {
                "type": "number",
                "value": 6,
                "units": "FT"
              }
            }
          ]
        },
        {
          "comments": [[], []],
          "type": "alias",
          "value": [
            {
              "comments": [[], []],
              "target": {
                "type": "identifier",
                "value": "PARAM1"
              },
              "type": "as_expression",
              "value": {
                "type": "parameter_name",
                "value": "ALIAS PARAM"
              }
            }
          ]
        },
        {
          "comments": [[], []],
          "type": "block",
          "blockType": "INITIATORS",
          "value": [
            {
              "comments": [[], ["Doc comment"]],
              "target": {
                "type": "identifier",
                "value": "INIT1"
              },
              "type": "assignment",
              "value": {
                "type": "boolean",
                "value": true
              }
            },
            {
              "comments": [[], []],
              "target": {
                "type": "identifier",
                "value": "INIT2"
              },
              "type": "assignment",
              "value": {
                "type": "number",
                "value": 0
              }
            }
          ]
        },
        {
          "comments": [[], []],
          "blockType": "WHEN",
          "test": {
            "type": "expression",
            "left": {
              "type": "identifier",
              "value": "TIM"
            },
            "op": ">=",
            "right": {
              "type": "number",
              "units": "S",
              "value": 0
            }
          },
          "type": "conditional_block",
          "value": [
            {
              "comments": [[], []],
              "target": {
                "type": "identifier",
                "value": "INIT1"
              },
              "type": "assignment",
              "value": {
                "type": "boolean",
                "value": false
              }
            }
          ]
        },
        {
          "comments": [[], []],
          "target": {
            "type": "parameter_name",
            "value": "PRINT INTERVAL"
          },
          "type": "is_expression",
          "value": {
            "type": "number",
            "value": 50
          }
        },
        {
          "comments": [[], []],
          "target": {
            "type": "parameter_name",
            "value": "START TIME"
          },
          "type": "is_expression",
          "value": {
            "type": "number",
            "units": "HR",
            "value": 0
          }
        },
        {
          "comments": [[], []],
          "target": {
            "type": "parameter_name",
            "value": "END TIME"
          },
          "type": "is_expression",
          "value": {
            "type": "number",
            "units": "HR",
            "value": 10
          }
        },
        {
          "comments": [[], []],
          "type": "plotfil",
          "n": 100,
          "value": [
            {
              "comments": [],
              "row": [
                {
                  "type": "parameter_name",
                  "value": "TIME IN SECONDS"
                }
              ]
            },
            {
              "comments": [],
              "row": [
                {
                  "type": "parameter_name",
                  "value": "ALIAS PARAM"
                }
              ]
            }
          ]
        }
      ]
    },
    "mainItem": true,
    "makeInputFileCode": "string exeLoc = \"C:/MAAP.exe\";\n        string paramLoc = \"C:/Test.PAR\";\n        string inpLoc = \"C:/Test.INP\";\n        string newInp = @\"SENSITIVITY ON\nTITLE\nTESTINP\nEND\nPARAMETER FILE Test.PAR\nINCLUDE Test.INC\nPARAMETER CHANGE\nPARAM1 = 5\nPARAM2(1) = 6 FT\nEND\nALIAS\nPARAM1 AS ALIAS PARAM\nEND\nINITIATORS\nINIT1 = T\nPARAM1 = T\nEND\nWHEN TIM >= 0 S\nINIT1 = F\nEND\nPRINT INTERVAL IS 50\nSTART TIME IS 0 HR\nEND TIME IS 10 HR\nPLOTFIL 100\nTIME IN SECONDS\nALIAS PARAM\nEND\";\n        string fileRefs = \"Test.PAR,Test.INC\"; //example \"PVGS_502.par, test.txt\";\n        string[] fileRefsList = fileRefs.Split(',');\n        \n        if (!Path.IsPathRooted(exeLoc))\n        {\n          exeLoc = Path.Join(Directory.GetCurrentDirectory(), exeLoc);\n        }\n        if (!Path.IsPathRooted(paramLoc))\n        {\n          paramLoc = Path.Join(Directory.GetCurrentDirectory(), paramLoc);\n        }\n        if (!Path.IsPathRooted(inpLoc))\n        {\n          inpLoc = Path.Join(Directory.GetCurrentDirectory(), inpLoc);\n        }\n        \n        string tempLoc = Path.Join(Environment.GetFolderPath(Environment.SpecialFolder.ApplicationData), \"EMRALD_MAAP\");\n        try\n        {\n          if (Directory.Exists(tempLoc))\n          {\n            Directory.Delete(tempLoc, true);\n          }\n          Directory.CreateDirectory(tempLoc);\n        }\n        catch { }\n        if (File.Exists(paramLoc) && !File.Exists(Path.Join(tempLoc, Path.GetFileName(paramLoc))))\n        {\n          File.Copy(paramLoc, Path.Join(tempLoc, Path.GetFileName(paramLoc)));\n        }\n        \n        string paramFileName = Path.GetFileName(paramLoc);\n        string inpFileName = Path.GetFileName(inpLoc);\n        string inpLocPath = Path.GetDirectoryName(inpLoc);\n        foreach (string fileRef in fileRefsList)\n        {\n          string fileRefPath = Path.Join(inpLocPath, fileRef);\n          if (File.Exists(fileRefPath) && !File.Exists(Path.Join(tempLoc, fileRef)))\n          {\n            if (fileRef != paramFileName)\n            File.Copy(fileRefPath, Path.Join(tempLoc, fileRef));\n          }\n          else\n          {\n            Console.WriteLine(\"Missing MAAP referenced file - \" + Path.Join(inpLocPath, fileRef));\n          }\n        }\n        string exeName = Path.GetFileName(exeLoc);\n        if (File.Exists(exeLoc) && !File.Exists(Path.Join(tempLoc, exeName)))\n        {\n          File.Copy(exeLoc, Path.Join(tempLoc, exeName));\n        }\n        string dllPath = Path.Join(Path.GetDirectoryName(exeLoc), exeName[..^7] + \".dll\");\n        if (File.Exists(dllPath) && !File.Exists(Path.Join(tempLoc, Path.GetFileName(dllPath))))\n        {\n          File.Copy(dllPath, Path.Join(tempLoc, Path.GetFileName(dllPath)));\n        }\n        \n        string newInpLoc = Path.Join(tempLoc, inpFileName);\n        System.IO.File.WriteAllText(newInpLoc, newInp);\n        return $\"{Path.Join(tempLoc, exeName)} {inpFileName} {paramFileName}\";",
    "processOutputFileCode": "string inpLoc = @\"C:/Test.INP\";\n  if (!Path.IsPathRooted(inpLoc))\n        inpLoc = RootPath + inpLoc;\n    string docVarPath = @\"./MAAP/temp.log\";\n  if (!Path.IsPathRooted(docVarPath))\n        docVarPath = RootPath + docVarPath;\n  string resLoc = Path.Join(Environment.GetFolderPath(Environment.SpecialFolder.ApplicationData), \"EMRALD_MAAP\", Path.GetFileNameWithoutExtension(inpLoc) + \".log\");\n  Directory.CreateDirectory(Path.GetDirectoryName(docVarPath));\n  File.Copy(resLoc, docVarPath, true);",
    "raType": "custom",
    "returnProcess": "rtNone",
    "codeVariables": []
  },
  "sets output": {
    "objType": "Action",
    "name": "sets output",
    "desc": "",
    "actType": "atRunExtApp",
    "exePath": "",
    "variableName": "Test DocLink Variable",
    "formData": {
      "caType": "MAAP",
      "docLinkVariable": "Test DocLink Variable",
      "output": "true",
      "exePath": "C:/MAAP.exe",
      "fileRefs": ["Test.PAR", "Test.INC"],
      "initiators": [
        {
          "comments": [[], ["Doc comment"]],
          "target": {
            "type": "identifier",
            "value": "INIT1"
          },
          "type": "assignment",
          "value": {
            "type": "boolean",
            "value": true
          }
        },
        {
          "comments": [[], []],
          "target": {
            "type": "identifier",
            "value": "INIT2"
          },
          "type": "assignment",
          "value": {
            "type": "number",
            "value": 0
          }
        }
      ],
      "inputBlocks": [
        {
          "comments": [[], []],
          "type": "conditional_block",
          "blockType": "WHEN",
          "test": {
            "type": "expression",
            "left": {
              "type": "identifier",
              "value": "TIM"
            },
            "op": ">=",
            "right": {
              "type": "number",
              "units": "S",
              "value": 0
            }
          },
          "value": [
            {
              "comments": [[], []],
              "target": {
                "type": "identifier",
                "value": "INIT1"
              },
              "type": "assignment",
              "value": {
                "type": "boolean",
                "value": false
              }
            }
          ]
        }
      ],
      "inputPath": "C:/Test.INP",
      "parameterPath": "C:/Test.PAR",
      "needsUpgrade": false,
      "parameters": [
        {
          "comments": [[], []],
          "target": {
            "type": "identifier",
            "value": "PARAM1"
          },
          "type": "assignment",
          "value": {
            "type": "number",
            "value": 5
          }
        },
        {
          "comments": [[], []],
          "target": {
            "type": "call_expression",
            "arguments": [
              {
                "type": "number",
                "value": 1
              }
            ],
            "value": {
              "type": "identifier",
              "value": "PARAM2"
            }
          },
          "type": "assignment",
          "value": {
            "type": "number",
            "value": 6,
            "units": "FT"
          }
        }
      ],
      "possibleInitiators": [
        {
          "desc": "PARAM1",
          "index": 100,
          "value": "T",
          "type": "parameter"
        },
        {
          "desc": "PARAM2",
          "index": 101,
          "value": "T",
          "type": "parameter"
        }
      ],
      "sourceElements": [
        {
          "comments": [[], []],
          "type": "sensitivity",
          "value": "ON"
        },
        {
          "comments": [[], []],
          "type": "title",
          "value": "TESTINP"
        },
        {
          "comments": [[], []],
          "fileType": "PARAMETER FILE",
          "type": "file",
          "value": "Test.PAR"
        },
        {
          "comments": [[], []],
          "fileType": "INCLUDE",
          "type": "file",
          "value": "Test.INC"
        },
        {
          "comments": [[], []],
          "type": "block",
          "blockType": "PARAMETER CHANGE",
          "value": [
            {
              "comments": [[], []],
              "target": {
                "type": "identifier",
                "value": "PARAM1"
              },
              "type": "assignment",
              "value": {
                "type": "number",
                "value": 5
              }
            },
            {
              "comments": [[], []],
              "target": {
                "arguments": [
                  {
                    "type": "number",
                    "value": 1
                  }
                ],
                "type": "call_expression",
                "value": {
                  "type": "identifier",
                  "value": "PARAM2"
                }
              },
              "type": "assignment",
              "value": {
                "type": "number",
                "value": 6,
                "units": "FT"
              }
            }
          ]
        },
        {
          "comments": [[], []],
          "type": "alias",
          "value": [
            {
              "comments": [[], []],
              "target": {
                "type": "identifier",
                "value": "PARAM1"
              },
              "type": "as_expression",
              "value": {
                "type": "parameter_name",
                "value": "ALIAS PARAM"
              }
            }
          ]
        },
        {
          "comments": [[], []],
          "type": "block",
          "blockType": "INITIATORS",
          "value": [
            {
              "comments": [[], ["Doc comment"]],
              "target": {
                "type": "identifier",
                "value": "INIT1"
              },
              "type": "assignment",
              "value": {
                "type": "boolean",
                "value": true
              }
            },
            {
              "comments": [[], []],
              "target": {
                "type": "identifier",
                "value": "INIT2"
              },
              "type": "assignment",
              "value": {
                "type": "number",
                "value": 0
              }
            }
          ]
        },
        {
          "comments": [[], []],
          "blockType": "WHEN",
          "test": {
            "type": "expression",
            "left": {
              "type": "identifier",
              "value": "TIM"
            },
            "op": ">=",
            "right": {
              "type": "number",
              "units": "S",
              "value": 0
            }
          },
          "type": "conditional_block",
          "value": [
            {
              "comments": [[], []],
              "target": {
                "type": "identifier",
                "value": "INIT1"
              },
              "type": "assignment",
              "value": {
                "type": "boolean",
                "value": false
              }
            }
          ]
        },
        {
          "comments": [[], []],
          "target": {
            "type": "parameter_name",
            "value": "PRINT INTERVAL"
          },
          "type": "is_expression",
          "value": {
            "type": "number",
            "value": 50
          }
        },
        {
          "comments": [[], []],
          "target": {
            "type": "parameter_name",
            "value": "START TIME"
          },
          "type": "is_expression",
          "value": {
            "type": "number",
            "units": "HR",
            "value": 0
          }
        },
        {
          "comments": [[], []],
          "target": {
            "type": "parameter_name",
            "value": "END TIME"
          },
          "type": "is_expression",
          "value": {
            "type": "number",
            "units": "HR",
            "value": 10
          }
        },
        {
          "comments": [[], []],
          "type": "plotfil",
          "n": 100,
          "value": [
            {
              "comments": [],
              "row": [
                {
                  "type": "parameter_name",
                  "value": "TIME IN SECONDS"
                }
              ]
            },
            {
              "comments": [],
              "row": [
                {
                  "type": "parameter_name",
                  "value": "ALIAS PARAM"
                }
              ]
            }
          ]
        }
      ]
    },
    "mainItem": true,
    "makeInputFileCode": "string exeLoc = \"C:/MAAP.exe\";\n        string paramLoc = \"C:/Test.PAR\";\n        string inpLoc = \"C:/Test.INP\";\n        string newInp = @\"SENSITIVITY ON\nTITLE\nTESTINP\nEND\nPARAMETER FILE Test.PAR\nINCLUDE Test.INC\nPARAMETER CHANGE\nPARAM1 = 5\nPARAM2(1) = 6 FT\nEND\nALIAS\nPARAM1 AS ALIAS PARAM\nEND\nINITIATORS\nINIT1 = T\nINIT2 = 0\nEND\nWHEN TIM >= 0 S\nINIT1 = F\nEND\nPRINT INTERVAL IS 50\nSTART TIME IS 0 HR\nEND TIME IS 10 HR\nPLOTFIL 100\nTIME IN SECONDS\nALIAS PARAM\nEND\";\n        string fileRefs = \"Test.PAR,Test.INC\"; //example \"PVGS_502.par, test.txt\";\n        string[] fileRefsList = fileRefs.Split(',');\n        \n        if (!Path.IsPathRooted(exeLoc))\n        {\n          exeLoc = Path.Join(Directory.GetCurrentDirectory(), exeLoc);\n        }\n        if (!Path.IsPathRooted(paramLoc))\n        {\n          paramLoc = Path.Join(Directory.GetCurrentDirectory(), paramLoc);\n        }\n        if (!Path.IsPathRooted(inpLoc))\n        {\n          inpLoc = Path.Join(Directory.GetCurrentDirectory(), inpLoc);\n        }\n        \n        string tempLoc = Path.Join(Environment.GetFolderPath(Environment.SpecialFolder.ApplicationData), \"EMRALD_MAAP\");\n        try\n        {\n          if (Directory.Exists(tempLoc))\n          {\n            Directory.Delete(tempLoc, true);\n          }\n          Directory.CreateDirectory(tempLoc);\n        }\n        catch { }\n        if (File.Exists(paramLoc) && !File.Exists(Path.Join(tempLoc, Path.GetFileName(paramLoc))))\n        {\n          File.Copy(paramLoc, Path.Join(tempLoc, Path.GetFileName(paramLoc)));\n        }\n        \n        string paramFileName = Path.GetFileName(paramLoc);\n        string inpFileName = Path.GetFileName(inpLoc);\n        string inpLocPath = Path.GetDirectoryName(inpLoc);\n        foreach (string fileRef in fileRefsList)\n        {\n          string fileRefPath = Path.Join(inpLocPath, fileRef);\n          if (File.Exists(fileRefPath) && !File.Exists(Path.Join(tempLoc, fileRef)))\n          {\n            if (fileRef != paramFileName)\n            File.Copy(fileRefPath, Path.Join(tempLoc, fileRef));\n          }\n          else\n          {\n            Console.WriteLine(\"Missing MAAP referenced file - \" + Path.Join(inpLocPath, fileRef));\n          }\n        }\n        string exeName = Path.GetFileName(exeLoc);\n        if (File.Exists(exeLoc) && !File.Exists(Path.Join(tempLoc, exeName)))\n        {\n          File.Copy(exeLoc, Path.Join(tempLoc, exeName));\n        }\n        string dllPath = Path.Join(Path.GetDirectoryName(exeLoc), exeName[..^7] + \".dll\");\n        if (File.Exists(dllPath) && !File.Exists(Path.Join(tempLoc, Path.GetFileName(dllPath))))\n        {\n          File.Copy(dllPath, Path.Join(tempLoc, Path.GetFileName(dllPath)));\n        }\n        \n        string newInpLoc = Path.Join(tempLoc, inpFileName);\n        System.IO.File.WriteAllText(newInpLoc, newInp);\n        return $\"{Path.Join(tempLoc, exeName)} {inpFileName} {paramFileName}\";",
    "processOutputFileCode": "string inpLoc = @\"C:/Test.INP\";\n  if (!Path.IsPathRooted(inpLoc))\n        inpLoc = RootPath + inpLoc;\n    string docVarPath = @\"./MAAP/temp.log\";\n  if (!Path.IsPathRooted(docVarPath))\n        docVarPath = RootPath + docVarPath;\n  string resLoc = Path.Join(Environment.GetFolderPath(Environment.SpecialFolder.ApplicationData), \"EMRALD_MAAP\", Path.GetFileNameWithoutExtension(inpLoc) + \".log\");\n  Directory.CreateDirectory(Path.GetDirectoryName(docVarPath));\n  File.Copy(resLoc, docVarPath, true);",
    "raType": "custom",
    "returnProcess": "rtNone",
    "codeVariables": []
  }
}
